<?xml version="1.0" encoding="utf-8" ?>
<curves xmlns:xsi="http://www.w3.org/2001/XMLSchema-instance"
        xsi:noNamespaceSchemaLocation="../schema.xsd">
    <curve>
        <id>nonprime128</id>
        <bits>128</bits>
        <field>prime</field>
        <file>nonprime128.csv</file>
    </curve>
    <curve>
        <id>nonprime160</id>
        <bits>160</bits>
        <field>prime</field>
        <file>nonprime160.csv</file>
    </curve>
    <curve>
        <id>nonprime192</id>
        <bits>192</bits>
        <field>prime</field>
        <file>nonprime192.csv</file>
    </curve>
    <curve>
        <id>nonprime224</id>
        <bits>224</bits>
        <field>prime</field>
        <file>nonprime224.csv</file>
    </curve>
    <curve>
        <id>nonprime256</id>
        <bits>256</bits>
        <field>prime</field>
        <file>nonprime256.csv</file>
    </curve>
    <curve>
        <id>nonprime384</id>
        <bits>384</bits>
        <field>prime</field>
        <file>nonprime384.csv</file>
    </curve>
    <curve>
        <id>nonprime521</id>
        <bits>521</bits>
        <field>prime</field>
        <file>nonprime521.csv</file>
    </curve>
</curves>