<?xml version="1.0" encoding="UTF-8" ?>
<curves xmlns:xsi="http://www.w3.org/2001/XMLSchema-instance"
        xsi:noNamespaceSchemaLocation="../schema.xsd">
	<curve>
		<id>miyaji128a1</id>
		<bits>128</bits>
		<field>prime</field>
		<file>miyaji128a1.csv</file>
		<desc>First curve in the "Proposed scheme A" section of Atsuko Miyaji's paper.</desc>
	</curve>
	<curve>
		<id>miyaji128a2</id>
		<bits>128</bits>
		<field>prime</field>
		<file>miyaji128a2.csv</file>
		<desc>Second curve in the "Proposed scheme A" section of Atsuko Miyaji's paper.</desc>
	</curve>
	<curve>
		<id>miyaji128b1</id>
		<bits>128</bits>
		<field>prime</field>
		<file>miyaji128b1.csv</file>
		<desc>First curve in the "Proposed scheme B" section of Atsuko Miyaji's paper.</desc>
	</curve>
	<curve>
		<id>miyaji128b2</id>
		<bits>128</bits>
		<field>prime</field>
		<file>miyaji128b2.csv</file>
		<desc>Second curve in the "Proposed scheme B" section of Atsuko Miyaji's paper.</desc>
	</curve>
</curves>
